{"ended_at_utc":"2026-10-07T22:09:34.856Z","last_accepted_as_of_date":null,"last_accepted_release_revision":null,"newer_attempt_not_accepted":true,"outcome":"rejected","reason_category":"source_contract_mismatch","schema_version":3,"source_publication_retired_on":"2026-09-02","source_publication_state":"retired","started_at_utc":"2026-10-07T22:01:28.315Z","trigger":"schedule"}
